{
  "version": "1",
  "general_profiles": {
    "general_mixed_global": {
      "id": "general_mixed_global",
      "common_name": "General Mixed Global",
      "emoji": "🐟",
      "regions": ["global"],
      "preferred_months": [],
      "preferred_temp_c": [],
      "preferred_wind_m_s": [],
      "preferred_swell_period_s": [],
      "max_wave_height_m": [],
      "preferred_tide_phase": ["high"],
      "preferred_times": [{"start_hour": 5, "end_hour": 9}, {"start_hour": 17, "end_hour": 19}],
      "moon_preference": ["full"]
    }
  },
  "regions": {
    "gibraltar_strait": {"id": "gibraltar_strait", "name": "Gibraltar Strait"},
    "south_africa_kzn": {"id": "south_africa_kzn", "name": "South Africa KZN"}
  },
  "species": {
    "sea_bass": {
      "common_name": "Sea Bass",
      "scientific_name": "Dicentrarchus labrax",
      "info": "https://en.wikipedia.org/wiki/European_seabass",
      "emoji": "🐟",
      "regions": ["gibraltar_strait"],
      "preferred_months": [4, 5, 6, 7, 8, 9],
      "preferred_temp_c": [10, 20],
      "preferred_wind_m_s": [0, 6],
      "preferred_swell_period_s": [],
      "max_wave_height_m": 2,
      "preferred_tide_phase": ["rising", "high"],
      "preferred_times": [{"start_hour": 5, "end_hour": 9}, {"start_hour": 17, "end_hour": 19}],
      "moon_preference": ["full"]
    },
    "mackerel": {
      "common_name": "Mackerel",
      "scientific_name": "Scomber scombrus",
      "info": "https://en.wikipedia.org/wiki/Atlantic_mackerel",
      "emoji": "🐠",
      "regions": ["gibraltar_strait"],
      "preferred_months": [5, 6, 7, 8, 9],
      "preferred_temp_c": [12, 22],
      "preferred_wind_m_s": [0, 8],
      "preferred_swell_period_s": [],
      "max_wave_height_m": 1.5,
      "preferred_tide_phase": ["falling"],
      "preferred_times": [{"start_hour": 6, "end_hour": 10}],
      "moon_preference": []
    },
    "shad": {
      "common_name": "Shad / Elf",
      "scientific_name": "Pomatomus saltatrix",
      "info": "https://en.wikipedia.org/wiki/Bluefish",
      "emoji": "🐟",
      "regions": ["south_africa_kzn"],
      "preferred_months": [5, 6, 7, 8],
      "preferred_temp_c": [16, 24],
      "preferred_wind_m_s": [0, 6],
      "preferred_swell_period_s": [],
      "max_wave_height_m": 2,
      "preferred_tide_phase": ["high"],
      "preferred_times": ["dawn", {"start_hour": 17, "end_hour": 21}],
      "moon_preference": []
    },
    "kob": {
      "common_name": "Kob / Kabeljou / Daga Salmon",
      "scientific_name": "Argyrosomus japonicus",
      "info": "https://www.rushofblue.com/dusky-kob/",
      "emoji": "🪝",
      "regions": ["south_africa_kzn"],
      "preferred_months": [8, 9, 10, 11],
      "preferred_temp_c": [13, 16],
      "preferred_wind_m_s": [0, 6],
      "preferred_swell_period_s": [],
      "max_wave_height_m": 3,
      "preferred_tide_phase": ["rising"],
      "preferred_times": ["dusk", {"start_hour": 5, "end_hour": 8}],
      "moon_preference": []
    },
    "natal_stumpnose": {
      "common_name": "Natal Stumpnose / Silver Bream / Yellowfin Bream",
      "scientific_name": "Rhabdosargus sarba",
      "info": "https://en.wikipedia.org/wiki/Rhabdosargus_sarba",
      "emoji": "🐠",
      "regions": ["south_africa_kzn"],
      "preferred_months": [5, 6, 7, 8, 9, 10],
      "preferred_temp_c": [18, 24],
      "preferred_wind_m_s": [0, 6],
      "preferred_swell_period_s": [],
      "max_wave_height_m": 1.5,
      "preferred_tide_phase": ["rising", "high"],
      "preferred_times": [{"start_hour": 17, "end_hour": 22}, {"start_hour": 5, "end_hour": 9}],
      "moon_preference": []
    },
    "blacktail": {
      "common_name": "Blacktail / Rock Bream",
      "scientific_name": "Diplodus capensis",
      "info": "https://www.fishinginfo.co.za/blacktail.html",
      "emoji": "🪸",
      "regions": ["south_africa_kzn"],
      "preferred_months": [4, 5, 6, 7, 8, 9, 10],
      "preferred_temp_c": [18, 24],
      "preferred_wind_m_s": [0, 8],
      "preferred_swell_period_s": [],
      "max_wave_height_m": 1.5,
      "preferred_tide_phase": ["rising", "falling"],
      "preferred_times": [{"start_hour": 6, "end_hour": 10}, {"start_hour": 16, "end_hour": 19}],
      "moon_preference": []
    },
    "galjoen": {
      "common_name": "Galjoen",
      "scientific_name": "Dichistius capensis",
      "info": "https://en.wikipedia.org/wiki/Galjoen",
      "emoji": "🐡",
      "regions": ["south_africa_kzn"],
      "preferred_months": [4, 5, 6, 7, 8, 9, 10],
      "preferred_temp_c": [16, 22],
      "preferred_wind_m_s": [0, 6],
      "preferred_swell_period_s": [],
      "max_wave_height_m": 2,
      "preferred_tide_phase": ["high"],
      "preferred_times": [{"start_hour": 5, "end_hour": 9}, {"start_hour": 16, "end_hour": 20}],
      "moon_preference": []
    },
    "mahi_mahi": {
      "common_name": "Mahi Mahi / Dorado",
      "scientific_name": "Coryphaena hippurus",
      "info": "https://en.wikipedia.org/wiki/Mahi-mahi",
      "emoji": "🐬",
      "regions": ["south_africa_kzn"],
      "preferred_months": [11, 12, 1, 2, 3, 4, 5],
      "preferred_temp_c": [22, 29],
      "preferred_wind_m_s": [0, 10],
      "preferred_swell_period_s": [],
      "max_wave_height_m": 2.5,
      "preferred_tide_phase": ["any"],
      "preferred_times": [{"start_hour": 5, "end_hour": 11}, {"start_hour": 15, "end_hour": 19}],
      "moon_preference": []
    },
    "yellowfin_tuna": {
      "common_name": "Yellowfin Tuna",
      "scientific_name": "Thunnus albacares",
      "info": "https://en.wikipedia.org/wiki/Yellowfin_tuna",
      "emoji": "🐟",
      "regions": ["south_africa_kzn"],
      "preferred_months": [10, 11, 12, 1, 2, 3, 4],
      "preferred_temp_c": [20, 28],
      "preferred_wind_m_s": [0, 12],
      "preferred_swell_period_s": [],
      "max_wave_height_m": 3,
      "preferred_tide_phase": ["any"],
      "preferred_times": [{"start_hour": 6, "end_hour": 12}, {"start_hour": 13, "end_hour": 17}],
      "moon_preference": []
    },
    "king_mackerel": {
      "common_name": "King Mackerel",
      "scientific_name": "Scomberomorus cavalla",
      "info": "https://en.wikipedia.org/wiki/King_mackerel",
      "emoji": "🐠",
      "regions": ["south_africa_kzn"],
      "preferred_months": [10, 11, 12, 1, 2, 3],
      "preferred_temp_c": [21, 27],
      "preferred_wind_m_s": [0, 10],
      "preferred_swell_period_s": [],
      "max_wave_height_m": 2,
      "preferred_tide_phase": ["rising", "falling"],
      "preferred_times": [{"start_hour": 5, "end_hour": 10}, {"start_hour": 16, "end_hour": 20}],
      "moon_preference": []
    },
    "wahoo": {
      "common_name": "Wahoo",
      "scientific_name": "Acanthocybium solandri",
      "info": "https://en.wikipedia.org/wiki/Wahoo_(fish)",
      "emoji": "⚡️",
      "regions": ["south_africa_kzn"],
      "preferred_months": [11, 12, 1, 2, 3, 4],
      "preferred_temp_c": [22, 29],
      "preferred_wind_m_s": [0, 12],
      "preferred_swell_period_s": [],
      "max_wave_height_m": 3,
      "preferred_tide_phase": ["any"],
      "preferred_times": [{"start_hour": 6, "end_hour": 12}, {"start_hour": 14, "end_hour": 18}],
      "moon_preference": []
    },
    "white_musselcracker": {
      "common_name": "White Musselcracker / Musselcracker Seabream",
      "scientific_name": "Sparodon durbanensis",
      "info": "https://www.marinelifeid.com/identification/musselcracker-seabream-sparodon-durbanensis/",
      "emoji": "🦀",
      "regions": ["south_africa_kzn"],
      "preferred_months": [11, 12, 1, 2, 3],
      "preferred_temp_c": [18, 25],
      "preferred_wind_m_s": [0, 8],
      "preferred_swell_period_s": [],
      "max_wave_height_m": 1.5,
      "preferred_tide_phase": ["rising", "high"],
      "preferred_times": ["dawn", "dusk"],
      "moon_preference": []
    }
  }
}